{
  "model_schema_version": "model.schema.v1",
  "required_plugins": [
    {
      "id": "generic-graph",
      "version": "2026.10.0"
    }
  ],
  "nodes": [
    {
      "id": "client",
      "type": "generic.actor",
      "label": "Client",
      "properties": {}
    },
    {
      "id": "api",
      "type": "generic.component",
      "label": "API",
      "properties": {}
    }
  ],
  "relationships": [
    {
      "id": "client-calls-api",
      "type": "generic.calls",
      "source": "client",
      "target": "api",
      "label": "calls",
      "properties": {}
    }
  ],
  "plugins": {
    "generic-graph": {
      "views": [
        {
          "id": "main",
          "label": "Main",
          "nodes": ["client", "api"],
          "relationships": ["client-calls-api"]
        }
      ]
    }
  }
}
