{
  "model_schema_version": "model.schema.v1",
  "required_plugins": [
    {
      "id": "generic-graph",
      "version": "2026.10.0"
    }
  ],
  "nodes": [
    {
      "id": "order-intake",
      "type": "ApplicationService",
      "label": "Order Intake",
      "properties": {}
    },
    {
      "id": "fulfillment-junction",
      "type": "OrJunction",
      "label": "or",
      "properties": {}
    },
    {
      "id": "fulfillment",
      "type": "ApplicationService",
      "label": "Fulfillment",
      "properties": {}
    },
    {
      "id": "notification",
      "type": "ApplicationService",
      "label": "Notification",
      "properties": {}
    },
    {
      "id": "approval-junction",
      "type": "AndJunction",
      "label": "and",
      "properties": {}
    }
  ],
  "relationships": [
    {
      "id": "intake-flows-junction",
      "type": "Flow",
      "source": "order-intake",
      "target": "fulfillment-junction",
      "label": "order accepted",
      "properties": {}
    },
    {
      "id": "junction-flows-fulfillment",
      "type": "Flow",
      "source": "fulfillment-junction",
      "target": "fulfillment",
      "label": "fulfil",
      "properties": {}
    },
    {
      "id": "junction-flows-notification",
      "type": "Flow",
      "source": "fulfillment-junction",
      "target": "notification",
      "label": "notify",
      "properties": {}
    },
    {
      "id": "fulfillment-flows-approval",
      "type": "Flow",
      "source": "fulfillment",
      "target": "approval-junction",
      "label": "fulfilled",
      "properties": {}
    },
    {
      "id": "approval-flows-notification",
      "type": "Flow",
      "source": "approval-junction",
      "target": "notification",
      "label": "approved",
      "properties": {}
    }
  ],
  "plugins": {
    "generic-graph": {
      "semantic_profile": "archimate",
      "views": [
        {
          "id": "main",
          "label": "Fulfillment Flow",
          "nodes": [
            "order-intake",
            "fulfillment-junction",
            "fulfillment",
            "notification",
            "approval-junction"
          ],
          "relationships": [
            "intake-flows-junction",
            "junction-flows-fulfillment",
            "junction-flows-notification",
            "fulfillment-flows-approval",
            "approval-flows-notification"
          ]
        }
      ]
    }
  }
}
